{"$schema":"https://json-schema.org/draft/2020-12/schema","$id":"https://mtl-archives.local/source-graph.schema.v1.json","type":"object","additionalProperties":false,"required":["schema_version","artifact_id","families","edges"],"properties":{"schema_version":{"const":"ground_authoritative_research_v1.5.0"},"artifact_id":{"const":"ground-authoritative-research-v1"},"families":{"type":"array","minItems":1,"items":{"type":"object","additionalProperties":false,"required":["family_id","label","independence_rule"],"properties":{"family_id":{"type":"string"},"label":{"type":"string"},"independence_rule":{"type":"string"}}}},"edges":{"type":"array","items":{"type":"object","additionalProperties":false,"required":["source_id","depends_on_family_id"],"properties":{"source_id":{"type":"string"},"depends_on_family_id":{"type":"string"}}}}}}
