{"artifact_id":"ground-authoritative-research-v1","edges":[{"depends_on_family_id":"banq-lovell-1927","source_id":"r0-lovell-1927"},{"depends_on_family_id":"banq-lovell-1927","source_id":"r0-lovell-lead"},{"depends_on_family_id":"banq-lovell-1932","source_id":"r10-lovell-1932-a"},{"depends_on_family_id":"banq-lovell-1932","source_id":"r10-lovell-1932-b"},{"depends_on_family_id":"banq-lovell-1932","source_id":"r10-lovell-1932-c"},{"depends_on_family_id":"city-vm94-z-series","source_id":"r10-city-archive-predecessor"},{"depends_on_family_id":"city-vm94-z-series","source_id":"r100-city-finding-aid"},{"depends_on_family_id":"rpcq-document-105269","source_id":"r100-rpcq-laurentien"},{"depends_on_family_id":"banq-lovell-1948","source_id":"r100-lovell-1948-a"},{"depends_on_family_id":"banq-lovell-1948","source_id":"r100-lovell-1948-b"},{"depends_on_family_id":"city-vm94-z-series","source_id":"r101-city-record"},{"depends_on_family_id":"banq-lovell-1948","source_id":"r101-lovell-1948-lead-1"},{"depends_on_family_id":"banq-lovell-1948","source_id":"r101-lovell-1948-lead-2"},{"depends_on_family_id":"banq-lovell-1948","source_id":"r101-lovell-1948-lead-3"},{"depends_on_family_id":"rpcq-document-105269","source_id":"r102-rpcq-st-george"},{"depends_on_family_id":"city-vm94-z-series","source_id":"r102-city-record"},{"depends_on_family_id":"banq-lovell-1944","source_id":"r105-lovell-1944"},{"depends_on_family_id":"cipo-trademark-register","source_id":"r105-cipo-1"},{"depends_on_family_id":"cipo-trademark-register","source_id":"r105-cipo-2"},{"depends_on_family_id":"cipo-trademark-register","source_id":"r105-cipo-3"},{"depends_on_family_id":"banq-lovell-1945","source_id":"r105-banq-1945-lead-1"},{"depends_on_family_id":"banq-lovell-1945","source_id":"r105-banq-1945-lead-2"},{"depends_on_family_id":"banq-lovell-1945","source_id":"r105-banq-1945-lead-3"},{"depends_on_family_id":"banq-lovell-1945","source_id":"r105-banq-1945-lead-4"}],"families":[{"family_id":"banq-lovell-1927","independence_rule":"one directory edition is one evidentiary family","label":"Lovell 1927 edition"},{"family_id":"banq-lovell-1932","independence_rule":"one directory edition is one evidentiary family","label":"Lovell 1932 edition"},{"family_id":"banq-lovell-1944","independence_rule":"one directory edition is one evidentiary family","label":"Lovell 1944 edition"},{"family_id":"banq-lovell-1945","independence_rule":"one directory edition is one evidentiary family","label":"Lovell 1945 edition"},{"family_id":"banq-lovell-1948","independence_rule":"one directory edition is one evidentiary family","label":"Lovell 1948 edition"},{"family_id":"city-vm94-z-series","independence_rule":"finding aids, CSV rows, and item pages are one archive family","label":"Ville de Montreal VM94 Z-series"},{"family_id":"cipo-trademark-register","independence_rule":"multiple register records are one register family","label":"CIPO trademark register"},{"family_id":"rpcq-register","independence_rule":"different register documents may be independent","label":"Quebec cultural heritage register"},{"family_id":"rpcq-document-105269","independence_rule":"all bounded observations of document 105269 are one evidentiary family","label":"RPCQ document 105269"},{"family_id":"parks-register","independence_rule":"each record is independently locatable but belongs to one register","label":"Parks Canada historic designations"},{"family_id":"city-toponymy","independence_rule":"toponymy context only","label":"Ville de Montreal toponymy"},{"family_id":"city-heritage-opinions","independence_rule":"distinct opinions; no cross-document corroboration claimed","label":"Montreal heritage opinions"},{"family_id":"lac-publications","independence_rule":"distinct cited publications","label":"Library and Archives Canada publications"},{"family_id":"historic-places-register","independence_rule":"official register context","label":"Canadian Register of Historic Places"},{"family_id":"institutional-st-george","independence_rule":"institutional context","label":"St George institutional history"},{"family_id":"banq-lapresse-4159254","independence_rule":"single independently locatable catalogue dossier","label":"La Presse dossier P833,S3,D469"},{"family_id":"banq-lapresse-3095625","independence_rule":"single newspaper edition","label":"La Presse 1927 edition"},{"family_id":"banq-armour-landry-3232855","independence_rule":"single independently locatable catalogue record","label":"Armour Landry catalogue record 3232855"},{"family_id":"hertz-history","independence_rule":"context only","label":"Hertz corporate history"},{"family_id":"power-history","independence_rule":"context only","label":"Power Corporation history"},{"family_id":"corporations-canada","independence_rule":"official register context","label":"Corporations Canada register"},{"family_id":"canada-publications","independence_rule":"official publication context","label":"Government of Canada publications"},{"family_id":"hotel-dieu-history","independence_rule":"official context","label":"Hotel-Dieu official institutional history"}],"schema_version":"ground_authoritative_research_v1.5.0"}
